{
  "id": "design-automation",
  "slug": "design-automation",
  "name": "Design Automation Intelligence",
  "version": "0.0.0",
  "author": "Huitzo",
  "icon": "ðŸŽ¨",
  "tagline": "AI Design Co-Pilot",
  "description": "Empower designers and solo founders to ship complete products faster. Generate UI mockups, create design systems, and produce production-ready codeâ€”all from simple CLI commands.",
  "category": "other",
  "status": "idea-phase",
  "features": [
    "AI-generated UI wireframes and high-fidelity mockups",
    "Automated design system creation (colors, typography, components)",
    "Production-ready code generation (React, Vue, Tailwind)",
    "A/B test variant generation with conversion predictions",
    "Accessibility compliance checking (WCAG AA/AAA)",
    "Design-to-code pipeline with component libraries"
  ],
  "installation": {
    "command": "huitzo plugin install design-automation",
    "requirements": ["Design tools integration", "Frontend framework selection", "Brand assets"]
  },
  "quickstart": [
    {
      "step": 1,
      "title": "Generate UI",
      "command": "design.ui.generate --concept=\"dashboard\" --style=modern"
    },
    {
      "step": 2,
      "title": "Create design system",
      "command": "design.system.create --brand=your-brand --export=figma"
    },
    {
      "step": 3,
      "title": "Generate variants",
      "command": "design.test.variants --page=landing --variants=3"
    },
    {
      "step": 4,
      "title": "Export code",
      "command": "design.export --format=react-tailwind --components=all"
    },
    {
      "step": 5,
      "title": "Accessibility check",
      "command": "design.accessibility.audit --standard=wcag-aa"
    }
  ],
  "commands": [
    {
      "name": "design.ui.generate",
      "description": "Generate complete UI designs from concepts",
      "usage": "design.ui.generate --concept=\"financial dashboard\" --style=modern-minimal"
    },
    {
      "name": "design.system.create",
      "description": "Create comprehensive design system from brand",
      "usage": "design.system.create --brand=huitzo --components=standard"
    },
    {
      "name": "design.test.variants",
      "description": "Generate A/B test design variants with predictions",
      "usage": "design.test.variants --page=landing --goal=conversion --variants=3"
    },
    {
      "name": "design.export",
      "description": "Export production-ready code from designs",
      "usage": "design.export --design-id=dashboard-v2 --format=react-tailwind --output=./src/components"
    },
    {
      "name": "design.accessibility.audit",
      "description": "Comprehensive accessibility compliance check",
      "usage": "design.accessibility.audit --design-id=dashboard-v2 --standard=wcag-aa"
    }
  ],
  "links": {
    "documentation": "https://docs.huitzo.com/plugins/design-automation",
    "support": "https://github.com/esola-thomas/huitzo/issues"
  }
}
