{
  "id": "scientific-research",
  "slug": "scientific-research",
  "name": "Scientific Computing Intelligence",
  "version": "0.0.0",
  "author": "Huitzo",
  "icon": "ðŸ”¬",
  "tagline": "AI-Accelerated Research Assistant",
  "description": "Accelerate research cycles from months to weeks. Design optimal experiments, analyze results with advanced statistics, and optimize processesâ€”making cutting-edge research methods accessible through the command line.",
  "category": "analytics",
  "status": "idea-phase",
  "features": [
    "Intelligent experimental design (factorial, response surface, DOE)",
    "Advanced statistical analysis with AI interpretation",
    "Optimization algorithms for process and parameter tuning",
    "Automated results visualization and reporting",
    "Literature review and citation management",
    "Reproducible research workflows and documentation"
  ],
  "installation": {
    "command": "huitzo plugin install scientific-research",
    "requirements": ["Research credentials", "Data analysis environment", "Statistical computing packages"]
  },
  "quickstart": [
    {
      "step": 1,
      "title": "Design experiment",
      "command": "research.experiment.design --goal=\"optimize-yield\" --variables=4"
    },
    {
      "step": 2,
      "title": "Analyze results",
      "command": "research.results.analyze --experiment-id=exp-001"
    },
    {
      "step": 3,
      "title": "Optimize parameters",
      "command": "research.optimize --objective=\"maximize-strength\" --method=bayesian"
    },
    {
      "step": 4,
      "title": "Generate report",
      "command": "research.report.generate --experiment=exp-001 --format=publication"
    },
    {
      "step": 5,
      "title": "Literature search",
      "command": "research.literature.search --topic=\"polymer-synthesis\" --years=2020-2025"
    }
  ],
  "commands": [
    {
      "name": "research.experiment.design",
      "description": "Generate optimal experimental design with statistical rigor",
      "usage": "research.experiment.design --goal=\"optimize-polymer-strength\" --constraints=budget:10k"
    },
    {
      "name": "research.results.analyze",
      "description": "Comprehensive statistical analysis with AI insights",
      "usage": "research.results.analyze --experiment-id=poly-001"
    },
    {
      "name": "research.optimize",
      "description": "Multi-objective optimization with constraint handling",
      "usage": "research.optimize --objective=\"maximize-yield,minimize-cost\" --method=pareto"
    },
    {
      "name": "research.literature.search",
      "description": "AI-powered literature review and synthesis",
      "usage": "research.literature.search --topic=\"CRISPR gene editing\" --years=2023-2025 --limit=50"
    }
  ],
  "links": {
    "documentation": "https://docs.huitzo.com/plugins/scientific-research",
    "support": "https://github.com/esola-thomas/huitzo/issues"
  }
}
