{
  "id": "multi-agent-orchestration",
  "slug": "multi-agent",
  "name": "Multi-Agent Orchestration",
  "version": "0.0.0",
  "author": "Huitzo",
  "icon": "üï∏Ô∏è",
  "tagline": "Distributed Intelligence Coordinator",
  "description": "Spawn and coordinate multiple AI agents to tackle complex workflows in parallel. Perfect for research tasks, competitive analysis, data gathering, and any job that requires distributed intelligence at scale.",
  "category": "automation",
  "status": "coming-soon",
  "features": [
    "Spawn multiple specialized AI agents on demand",
    "Coordinate parallel workflows with intelligent task distribution",
    "Real-time agent status monitoring and progress tracking",
    "Automatic failure recovery and agent reallocation",
    "Result synthesis and aggregation from multiple sources",
    "Cost optimization through intelligent agent scheduling"
  ],
  "installation": {
    "command": "huitzo intelligence pack install multi-agent",
    "requirements": ["Huitzo Pro account", "Workflow configuration"]
  },
  "quickstart": [
    {
      "step": 1,
      "title": "Launch workflow",
      "command": "agents.workflow.start --task=\"competitor-analysis\" --agents=5"
    },
    {
      "step": 2,
      "title": "Check status",
      "command": "agents.status"
    },
    {
      "step": 3,
      "title": "View results",
      "command": "agents.results --workflow=latest"
    },
    {
      "step": 4,
      "title": "Stop workflow",
      "command": "agents.workflow.stop --id=workflow-123"
    },
    {
      "step": 5,
      "title": "Review history",
      "command": "agents.history --date=today"
    }
  ],
  "commands": [
    {
      "name": "agents.workflow.start",
      "description": "Launch multi-agent workflow for complex tasks",
      "usage": "agents.workflow.start --task=\"competitor-analysis\" --agents=5"
    },
    {
      "name": "agents.status",
      "description": "View current agent network status",
      "usage": "agents.status"
    },
    {
      "name": "agents.results",
      "description": "Retrieve and synthesize results from workflow",
      "usage": "agents.results --workflow=latest --format=summary"
    },
    {
      "name": "agents.workflow.create",
      "description": "Define custom multi-agent workflow template",
      "usage": "agents.workflow.create --name=\"market-research\" --template=research.yaml"
    }
  ],
  "links": {
    "documentation": "https://docs.huitzo.com/plugins/multi-agent",
    "support": "https://github.com/esola-thomas/huitzo/issues"
  }
}
