{
  "id": "gov-compliance",
  "slug": "gov-compliance",
  "name": "Government & Enterprise Compliance",
  "version": "0.0.0",
  "author": "Huitzo",
  "icon": "üèõÔ∏è",
  "tagline": "AI-Powered Bureaucracy Navigator",
  "description": "Navigate complex government regulations and enterprise compliance requirements with AI assistance. Automate FedRAMP preparation, regulatory analysis, policy documentation, and audit trails‚Äîreducing consulting costs by 70-80%.",
  "category": "automation",
  "status": "idea-phase",
  "features": [
    "FedRAMP compliance roadmap and documentation generation",
    "Automated regulation impact analysis",
    "Policy and procedure documentation with AI assistance",
    "Continuous compliance monitoring and gap analysis",
    "Audit trail generation and retention management",
    "Multi-framework support (FedRAMP, SOC2, ISO 27001, GDPR)"
  ],
  "installation": {
    "command": "huitzo intelligence pack install gov-compliance",
    "requirements": ["Enterprise account", "System documentation access", "Compliance framework selection"]
  },
  "quickstart": [
    {
      "step": 1,
      "title": "Initialize framework",
      "command": "gov.framework.init --standard=fedramp --level=moderate"
    },
    {
      "step": 2,
      "title": "Generate SSP",
      "command": "gov.fedramp.prepare --product=\"YourProduct\" --target-level=moderate"
    },
    {
      "step": 3,
      "title": "Analyze regulation",
      "command": "gov.policy.analyze --regulation=\"SEC-Form-10K\""
    },
    {
      "step": 4,
      "title": "Run gap analysis",
      "command": "gov.compliance.audit --framework=fedramp"
    },
    {
      "step": 5,
      "title": "Generate documentation",
      "command": "gov.docs.generate --controls=all"
    }
  ],
  "commands": [
    {
      "name": "gov.fedramp.prepare",
      "description": "Generate FedRAMP compliance roadmap and documentation",
      "usage": "gov.fedramp.prepare --product=\"Huitzo CLI\" --target-level=moderate"
    },
    {
      "name": "gov.policy.analyze",
      "description": "Analyze regulatory requirements and impact on operations",
      "usage": "gov.policy.analyze --regulation=\"SEC-Form-10K\" --operation=\"financial-reporting\""
    },
    {
      "name": "gov.compliance.audit",
      "description": "Run compliance gap analysis across all controls",
      "usage": "gov.compliance.audit --framework=fedramp --level=moderate"
    },
    {
      "name": "gov.docs.generate",
      "description": "Auto-generate compliance documentation",
      "usage": "gov.docs.generate --controls=AC-1,AC-2,AC-3 --format=markdown"
    }
  ],
  "links": {
    "documentation": "https://docs.huitzo.com/plugins/gov-compliance",
    "support": "https://github.com/esola-thomas/huitzo/issues"
  }
}
