{
  "id": "pack-id",
  "slug": "pack-slug",
  "name": "Intelligence Pack Name",
  "version": "0.0.1",
  "author": "Author Name",
  "icon": "ðŸ“¦",
  "tagline": "Short one-liner description",
  "description": "Longer description explaining what this intelligence pack does and why users would want it.",
  "category": "automation",
  "status": "coming-soon",
  "features": ["Feature 1", "Feature 2", "Feature 3"],
  "pricing": {
    "free": {
      "available": true,
      "limits": "Usage limits",
      "features": []
    },
    "pro": {
      "price": "$X/month",
      "features": []
    }
  },
  "installation": {
    "command": "huitzo pack install pack-name",
    "requirements": []
  },
  "quickstart": [],
  "commands": [],
  "links": {
    "documentation": "https://huitzo.com/intelligence-packs/pack-name",
    "repository": "https://github.com/esola-thomas/huitzo",
    "support": "https://github.com/esola-thomas/huitzo/issues/new"
  }
}
